{
  "$schema": "https://json-schema.org/draft/2020-12/schema",
  "$id": "https://github.com/jianruntech/geo-score/blob/main/schema/report.v1.json",
  "title": "AIV audit report",
  "description": "The output shape of an AIV audit. Implementations that emit this can be compared with each other.",
  "type": "object",
  "required": ["rubric_version", "audited_at", "target", "sampled_urls", "checks", "score", "observable_max", "normalised", "band"],
  "additionalProperties": false,
  "properties": {
    "rubric_version": {
      "type": "string", "pattern": "^v[0-9]+\\.[0-9]+$",
      "description": "A score without this is not comparable to anything."
    },
    "audited_at": { "type": "string", "format": "date", "description": "Engine behaviour moves; a score is a point-in-time reading." },
    "target": { "type": "string", "format": "uri" },
    "audience_language": { "type": "string", "description": "BCP-47. Determines whether the non-English engine check applies." },
    "sampled_urls": {
      "type": "array", "items": { "type": "string", "format": "uri" }, "minItems": 1,
      "description": "Every URL the audit read. Without these the score cannot be reproduced."
    },
    "checks": {
      "type": "array", "minItems": 1,
      "items": {
        "type": "object",
        "required": ["id", "state"],
        "additionalProperties": false,
        "properties": {
          "id": { "type": "string", "pattern": "^p[1-5]\\.[a-z0-9-]+$", "description": "Stable id from rubric/vX.Y.json" },
          "state": { "enum": ["scored", "failed", "unobservable", "not_applicable"] },
          "points": { "type": "integer", "minimum": 0, "description": "Required when state is scored or failed; absent otherwise" },
          "max": { "type": "integer", "minimum": 1 },
          "evidence": { "type": "string", "description": "What was observed. Required for failed and unobservable — an audit that hides its reasoning is worth less than a lower score" },
          "reason": { "type": "string", "description": "Why a check is unobservable or not_applicable" }
        }
      }
    },
    "score": { "type": "integer", "minimum": 0, "description": "Sum of points across scored and failed checks" },
    "observable_max": { "type": "integer", "minimum": 1, "description": "100 minus the points of unobservable and not_applicable checks" },
    "normalised": { "type": "integer", "minimum": 0, "maximum": 100, "description": "round(score / observable_max * 100). The band is read from this, not from score" },
    "band": { "enum": ["Critical", "Below average", "Good", "Strong", "Leading"] },
    "excluded": {
      "type": "array",
      "description": "Checks removed from the denominator, with their point value and reason. Two scores are comparable only when their observable_max match.",
      "items": {
        "type": "object", "required": ["id", "points", "reason"], "additionalProperties": false,
        "properties": {
          "id": { "type": "string" }, "points": { "type": "integer" },
          "reason": { "enum": ["unobservable", "not_applicable"] },
          "detail": { "type": "string" }
        }
      }
    },
    "notes": { "type": "string" }
  }
}
