{
  "rubric_version": "v1.0",
  "audited_at": "2026-09-08",
  "target": "https://nextjs.org",
  "audience_language": "en",
  "sampled_urls": [
    "https://nextjs.org/",
    "https://nextjs.org/docs/app/api-reference/adapters/supported-providers",
    "https://nextjs.org/docs/app/api-reference/config/next-config-js/allowedDevOrigins",
    "https://nextjs.org/docs/app/api-reference/config/next-config-js/serverActions",
    "https://nextjs.org/blog/how-we-closed-1500-github-issues",
    "https://nextjs.org/blog/turbopack-chunking",
    "https://nextjs.org/blog/nextjs-security-release-august-2026-update",
    "https://nextjs.org/blog/august-2026-security-release"
  ],
  "checks": [
    {
      "id": "p1.robots-allows-retrieval",
      "state": "scored",
      "points": 3,
      "max": 3,
      "evidence": "robots.txt returns 200 and is 40 bytes long. Its entire content is one line: `Sitemap: https://nextjs.org/sitemap.xml` (verified byte-exact with xxd). There is no User-agent stanza and no Disallow directive anywhere in the file, so none of the 10 retrieval crawlers in reference/ai-crawlers.md is disallowed. floor(3 x 10/10) = 3."
    },
    {
      "id": "p1.retrieval-reachable",
      "state": "scored",
      "points": 3,
      "max": 3,
      "evidence": "Requested https://nextjs.org/ once per retrieval user-agent. All 10 returned 200 with the real page (the string 'The React Framework' present in every response, no challenge page, no interstitial). Note on the response shape: nextjs.org content-negotiates on user-agent. OAI-SearchBot, ChatGPT-User, Claude-SearchBot, Claude-User, PerplexityBot, Perplexity-User and Amazonbot each received text/markdown, 3,939 bytes (the /llms.md orientation document); Googlebot received text/html, 345,712 bytes; bingbot and Applebot received text/html, 446,849 bytes. All 10 are reachable, so floor(3 x 10/10) = 3."
    },
    {
      "id": "p1.llms-txt",
      "state": "scored",
      "points": 3,
      "max": 3,
      "evidence": "/llms.txt returns 200, text/plain, 12,724 bytes, 125 lines. Valid Markdown. One H1 ('# Next.js'), one summary blockquote ('> The React Framework for the Web'), 5 H2 sections of which 3 carry link groups: Documentation (6 links), Learn Next.js (4 links), Blog (35 links); 45 link-list items total. Meets the >=3 sectioned link groups bar exactly, with no margin."
    },
    {
      "id": "p1.llms-full-txt",
      "state": "scored",
      "points": 2,
      "max": 2,
      "evidence": "The conventional root path https://nextjs.org/llms-full.txt returns 404 (x-matched-path: /404), as do /llms_full.txt and /llmsfull.txt. The full corpus resolves instead at https://nextjs.org/docs/llms-full.txt: 200, text/plain, content-length 3,970,025 bytes, i.e. 312x the size of /llms.txt. It is discoverable rather than hidden: /llms.txt links to it twice, and /.well-known/ai-catalog.json declares it as entry urn:ai:nextjs.org:docs:full. Scored because the rubric's pass condition for this check states only 'Resolves and is substantially longer than llms.txt' and pins no path, unlike the preceding check which explicitly requires /llms.txt. A reader who requires the root path would score this 0 and the site total 38/82."
    },
    {
      "id": "p1.ai-txt",
      "state": "failed",
      "points": 0,
      "max": 2,
      "evidence": "https://nextjs.org/ai.txt returns 404 (content-type text/html, x-matched-path: /404, content-disposition filename=\"404\"). https://nextjs.org/.well-known/ai.txt also returns 404. Judged on status code only; both 404 responses carry a 12,207-byte HTML body, which is the site's rendered 404 page, not a policy file."
    },
    {
      "id": "p1.sitemap",
      "state": "scored",
      "points": 3,
      "max": 3,
      "evidence": "https://nextjs.org/sitemap.xml returns 200, application/xml, 103,007 bytes. Single flat urlset (no sitemapindex) with 734 <loc> entries, every one of which carries a <lastmod>. It is referenced from robots.txt - that reference is robots.txt's only line. The site is single-locale (JSON-LD WebSite declares inLanguage 'en'; no locale path prefix appears in any of the 734 URLs; no hreflang alternates in any sampled <head>), so 'all indexable locales' is one locale and it is covered. Spot-checked 9 paths: /docs/app/getting-started/installation, /docs/app/getting-started, /showcase, /blog, /learn, /docs/messages/no-unwanted-polyfillio all return 200 and are all present; /templates, /enterprise and /docs/16/app/getting-started are absent but also return 404 on this domain (they are off-domain links to vercel.com), so their absence is correct."
    },
    {
      "id": "p1.geo-link-tags",
      "state": "failed",
      "points": 0,
      "max": 2,
      "evidence": "Grepped the <head> of all 8 sampled pages for rel values containing 'llms' or 'ai-policy': zero matches. Also checked the HTTP Link response header on the homepage and on a docs page - it carries only rel=preload entries for fonts and images. The site does publish a machine-readable pointer, but by a different mechanism the rubric does not name: <link rel=\"alternate\" type=\"text/markdown\" href=\"...\"> on the homepage and both docs pages (blog pages instead use rel=alternate type=application/rss+xml), plus /.well-known/ai-catalog.json. None of these is rel=\"llms\", rel=\"llms-full\" or rel=\"ai-policy\", so the check as written does not pass."
    },
    {
      "id": "p1.ssr-content",
      "state": "scored",
      "points": 2,
      "max": 2,
      "evidence": "Fetched all 8 sampled URLs with curl (no JavaScript executed) using a Chrome 131 user-agent: all returned 200 text/html carrying the primary content. Homepage: 345,712 bytes of HTML yielding 7,722 characters of visible text after stripping script/style/tags, including the H1 'The React Framework for the Web', the feature sections and the customer testimonials. Docs and blog pages likewise: 8,568 / 7,973 / 10,284 / 10,269 / 13,419 / 2,417 / 3,357 visible characters respectively. This corrects the briefing figure of '~3.9KB SSR body': 3,939 bytes is the size of the markdown document nextjs.org serves to recognised AI user-agents, not the server-rendered HTML."
    },
    {
      "id": "p2.organization-website",
      "state": "failed",
      "points": 0,
      "max": 4,
      "evidence": "Not sitewide. Homepage: one ld+json block with an @graph carrying SoftwareApplication (@id #software, softwareVersion 16.3.4), WebSite (@id #website) and Organization (@id #publisher, name 'Vercel'). But /docs/app/api-reference/config/next-config-js/allowedDevOrigins and .../serverActions carry only a TechArticle whose author is an inline Organization - no WebSite node. All 4 blog posts carry only a TechArticle with Person authors - no Organization node and no WebSite node. And /docs/app/api-reference/adapters/supported-providers contains zero ld+json blocks at all, despite being the single most recently modified URL in the sitemap. All-or-nothing, so 0."
    },
    {
      "id": "p2.article-author",
      "state": "scored",
      "points": 4,
      "max": 4,
      "evidence": "Denominator: the 4 blog articles in the sample. All 4 carry JSON-LD @type TechArticle (an Article subtype) with a named Person author: Marcos Hernanz; Sam Poder; and Josh Story + Karim Rahal + Sebastian Silbermann on both security posts. Identity resolves - the rendered byline links each name to a public profile (e.g. 'Posted by Marcos Hernanz @marcoshernanz' -> https://twitter.com/marcoshernanz; 'Sam Poder @sam_poder' -> https://twitter.com/sam_poder). floor(4 x 4/4) = 4. Weakness recorded but not penalised here: the resolution lives in the HTML byline, not in the structured data - each Person object carries only name and image, no url, sameAs or @id - and the markdown variant that AI crawlers receive lists authors as bare names in frontmatter with no handle or URL. The 2 sampled docs pages are excluded from the denominator as collectively-maintained reference material rather than articles; had they been included they would fail (their TechArticle author is the Organization 'Vercel'), giving floor(4 x 4/6) = 2."
    },
    {
      "id": "p2.faqpage",
      "state": "not_applicable",
      "max": 3,
      "reason": "not_applicable",
      "evidence": "No page in the fixed 8-URL sample is structured as questions - headings are API identifiers ('allowedDevOrigins', 'serverActions', 'bodySizeLimit'), release headlines ('August 2026 Security Release') or narrative section titles ('Clearing the backlog', 'Three chunking strategies'). Widened the look beyond the sample as a sanity check: 0 case-insensitive occurrences of 'faq' in /docs/llms.txt, the 48,355-byte index of all 508 documentation URLs. The denominator for this proportional check is therefore 0 and its 3 points leave the denominator. Not a defect - an API reference site legitimately has no Q&A-structured pages."
    },
    {
      "id": "p2.speakable",
      "state": "failed",
      "points": 0,
      "max": 3,
      "evidence": "3 of the 8 sampled pages do have a clear answer passage (see p3.answer-passages): the homepage, /docs/.../allowedDevOrigins and /blog/august-2026-security-release. The string 'speakable' appears zero times in any of the 8 pages' HTML. floor(3 x 0/3) = 0. This check applies and is unmet, so it stays in the denominator."
    },
    {
      "id": "p2.product-offer",
      "state": "not_applicable",
      "max": 3,
      "reason": "not_applicable",